/usr/bin/time is required to use logging.timed true

Flux install root: /mnt/flux/view

🟧️  wait-fs: 2024/11/10 22:55:17 wait-fs.go:40: /mnt/flux/flux-operator-done.txt
🟧️  wait-fs: 2024/11/10 22:55:17 wait-fs.go:49: Found existing path /mnt/flux/flux-operator-done.txt
Python version: /mnt/flux/view/bin/python3.11
Python root: /mnt/flux/view/lib/python3.11
PYTHONPATH is :/mnt/flux/view/lib/python3.11/site-packages
PATH is /usr/local/sbin:/usr/local/bin:/usr/sbin:/usr/bin:/sbin:/bin:/mnt/flux/view/bin
/mnt/flux/view/lib/libpython3.so
/mnt/flux/view/lib/libpython3.11.so.1.0
/mnt/flux/view/lib/libpython3.11.so
./mnt/flux/software/linux-ubuntu22.04-x86_64/gcc-11.4.0/python-3.11.7-dne37dvjelr7oaag76ipidxkt5uyr5is/lib/libpython3.so
./mnt/flux/software/linux-ubuntu22.04-x86_64/gcc-11.4.0/python-3.11.7-dne37dvjelr7oaag76ipidxkt5uyr5is/lib/libpython3.11.so.1.0
./mnt/flux/software/linux-ubuntu22.04-x86_64/gcc-11.4.0/python-3.11.7-dne37dvjelr7oaag76ipidxkt5uyr5is/lib/libpython3.11.so
./mnt/flux/view/lib/libpython3.so
./mnt/flux/view/lib/libpython3.11.so.1.0
./mnt/flux/view/lib/libpython3.11.so
./opt/software/linux-ubuntu22.04-x86_64/gcc-11.4.0/python-3.11.7-dne37dvjelr7oaag76ipidxkt5uyr5is/lib/libpython3.so
./opt/software/linux-ubuntu22.04-x86_64/gcc-11.4.0/python-3.11.7-dne37dvjelr7oaag76ipidxkt5uyr5is/lib/libpython3.11.so.1.0
./opt/software/linux-ubuntu22.04-x86_64/gcc-11.4.0/python-3.11.7-dne37dvjelr7oaag76ipidxkt5uyr5is/lib/libpython3.11.so
lrwxrwxrwx 1 root root 121 Nov 10 22:55 /mnt/flux/view/lib/libpython3.11.so.1.0 -> /opt/software/linux-ubuntu22.04-x86_64/gcc-11.4.0/python-3.11.7-dne37dvjelr7oaag76ipidxkt5uyr5is/lib/libpython3.11.so.1.0

Hello user root

🌟️ Curve Certificate
curve.cert
#   ****  Generated on 2023-04-26 22:54:42 by CZMQ  ****
#   ZeroMQ CURVE **Secret** Certificate
#   DO NOT PROVIDE THIS FILE TO OTHER USERS nor change its permissions.
    
metadata
    name = "flux-cert-generator"
    keygen.hostname = "flux-sample-0"
curve
    public-key = "TyH/8?=%e*.Th1L!U0e?gO$MM}6N5-OPKQZ=A(8y"
    secret-key = "m5fBxQ4:H%vt82d[z9r)I8{huLLB!WYLL069N:nT"
👋 Hello, I'm flux-sample-0
The main host is flux-sample-0
The working directory is /, contents include:
bin   dev  flux_operator  lib	 lib64	 media	opt   root  sbin  sys  usr
boot  etc  home		  lib32  libx32  mnt	proc  run   srv   tmp  var
0% [Working]            Get:1 http://archive.ubuntu.com/ubuntu jammy InRelease [270 kB]
            Get:2 http://security.ubuntu.com/ubuntu jammy-security InRelease [129 kB]
0% [1 InRelease 11.0 kB/270 kB 4%] [2 InRelease 13.8 kB/129 kB 11%]                                                                   0% [1 InRelease 149 kB/270 kB 55%]                                  0% [Working]            Get:3 http://archive.ubuntu.com/ubuntu jammy-updates InRelease [128 kB]
0% [3 InRelease 24.6 kB/128 kB 19%]                                   0% [Working]0% [Waiting for headers]                        Get:4 http://archive.ubuntu.com/ubuntu jammy-backports InRelease [127 kB]
0% [4 InRelease 2508 B/127 kB 2%] [Waiting for headers]                                                       Get:5 http://security.ubuntu.com/ubuntu jammy-security/main amd64 Packages [2397 kB]
0% [4 InRelease 110 kB/127 kB 86%] [5 Packages 2605 B/2397 kB 0%]                                                                 0% [5 Packages 67.4 kB/2397 kB 3%]                                  0% [5 Packages 107 kB/2397 kB 4%]                                 Get:6 http://archive.ubuntu.com/ubuntu jammy/multiverse amd64 Packages [266 kB]
0% [6 Packages 2577 B/266 kB 1%] [5 Packages 295 kB/2397 kB 12%]0% [6 Packages 266 kB/266 kB 100%] [5 Packages 498 kB/2397 kB 21%]                                                                  0% [5 Packages 676 kB/2397 kB 28%]0% [6 Packages store 0 B] [Waiting for headers] [5 Packages 678 kB/2397 kB 28%]                                                                               0% [Waiting for headers] [5 Packages 739 kB/2397 kB 31%]                                                        Get:7 http://archive.ubuntu.com/ubuntu jammy/main amd64 Packages [1792 kB]
0% [7 Packages 2575 B/1792 kB 0%] [5 Packages 1444 kB/2397 kB 60%]18% [7 Packages 44.8 kB/1792 kB 3%] [5 Packages 1522 kB/2397 kB 63%]                                                                    22% [7 Packages 532 kB/1792 kB 30%]22% [5 Packages store 0 B] [7 Packages 532 kB/1792 kB 30%]                                                          Get:8 http://security.ubuntu.com/ubuntu jammy-security/restricted amd64 Packages [3241 kB]
23% [5 Packages store 0 B] [7 Packages 1168 kB/1792 kB 65%] [8 Packages 27.9 kB                                                                               27% [7 Packages 1506 kB/1792 kB 84%] [8 Packages 926 kB/3241 kB 29%]                                                                    31% [Waiting for headers] [8 Packages 2481 kB/3241 kB 77%]                                                          Get:9 http://archive.ubuntu.com/ubuntu jammy/universe amd64 Packages [17.5 MB]
31% [9 Packages 36.6 kB/17.5 MB 0%] [8 Packages 2481 kB/3241 kB 77%]31% [7 Packages store 0 B] [9 Packages 36.6 kB/17.5 MB 0%] [8 Packages 2481 kB/37% [7 Packages store 0 B] [9 Packages 2175 kB/17.5 MB 12%] [Waiting for header                                                                               Get:10 http://security.ubuntu.com/ubuntu jammy-security/multiverse amd64 Packages [44.7 kB]
                                                                               Get:11 http://security.ubuntu.com/ubuntu jammy-security/universe amd64 Packages [1163 kB]
38% [7 Packages store 0 B] [9 Packages 2175 kB/17.5 MB 12%] [11 Packages 90.1 k                                                                               41% [7 Packages store 0 B] [9 Packages 2556 kB/17.5 MB 15%]                                                           42% [9 Packages 2691 kB/17.5 MB 15%]42% [8 Packages store 0 B] [9 Packages 2713 kB/17.5 MB 16%]                                                           62% [9 Packages 11.2 MB/17.5 MB 64%]62% [10 Packages store 0 B] [9 Packages 11.2 MB/17.5 MB 64%]                                                            63% [9 Packages 11.4 MB/17.5 MB 65%]63% [11 Packages store 0 B] [9 Packages 11.4 MB/17.5 MB 65%]                                                            68% [9 Packages 13.3 MB/17.5 MB 76%]                                    78% [Waiting for headers]                         Get:12 http://archive.ubuntu.com/ubuntu jammy/restricted amd64 Packages [164 kB]
78% [12 Packages 89.3 kB/164 kB 54%]78% [9 Packages store 0 B] [12 Packages 89.3 kB/164 kB 54%]                                                           78% [9 Packages store 0 B] [Waiting for headers]                                                Get:13 http://archive.ubuntu.com/ubuntu jammy-updates/main amd64 Packages [2696 kB]
78% [9 Packages store 0 B] [13 Packages 95.2 kB/2696 kB 4%]                                                           84% [9 Packages store 0 B] [Waiting for headers]                                                Get:14 http://archive.ubuntu.com/ubuntu jammy-updates/universe amd64 Packages [1452 kB]
84% [9 Packages store 0 B] [14 Packages 81.9 kB/1452 kB 6%]                                                           87% [9 Packages store 0 B] [Waiting for headers]                                                Get:15 http://archive.ubuntu.com/ubuntu jammy-updates/multiverse amd64 Packages [51.8 kB]
                                                Get:16 http://archive.ubuntu.com/ubuntu jammy-updates/restricted amd64 Packages [3353 kB]
88% [9 Packages store 0 B] [16 Packages 88.5 kB/3353 kB 3%]                                                           95% [9 Packages store 0 B] [Waiting for headers]                                                Get:17 http://archive.ubuntu.com/ubuntu jammy-backports/universe amd64 Packages [33.7 kB]
                                                Get:18 http://archive.ubuntu.com/ubuntu jammy-backports/main amd64 Packages [81.4 kB]
96% [9 Packages store 0 B] [18 Packages 81.4 kB/81.4 kB 100%]                                                             96% [9 Packages store 0 B]96% [9 Packages store 0 B]                          96% [Working]96% [12 Packages store 0 B]                           97% [Working]97% [13 Packages store 0 B]                           97% [Working]97% [14 Packages store 0 B]                           98% [Working]98% [15 Packages store 0 B]                           98% [Working]98% [16 Packages store 0 B]                           99% [Working]99% [17 Packages store 0 B]                           99% [Working]99% [18 Packages store 0 B]                           100% [Working]              Fetched 34.9 MB in 4s (7949 kB/s)
Reading package lists... 0%Reading package lists... 0%Reading package lists... 0%Reading package lists... 4%Reading package lists... 4%Reading package lists... 5%Reading package lists... 5%Reading package lists... 51%Reading package lists... 51%Reading package lists... 52%Reading package lists... 52%Reading package lists... 52%Reading package lists... 60%Reading package lists... 60%Reading package lists... 72%Reading package lists... 72%Reading package lists... 76%Reading package lists... 76%Reading package lists... 76%Reading package lists... 76%Reading package lists... 77%Reading package lists... 77%Reading package lists... 77%Reading package lists... 77%Reading package lists... 84%Reading package lists... 84%Reading package lists... 95%Reading package lists... 95%Reading package lists... 99%Reading package lists... 99%Reading package lists... 99%Reading package lists... 99%Reading package lists... Done
Reading package lists... 0%Reading package lists... 0%Reading package lists... 0%Reading package lists... 4%Reading package lists... 4%Reading package lists... 5%Reading package lists... 5%Reading package lists... 51%Reading package lists... 51%Reading package lists... 52%Reading package lists... 52%Reading package lists... 59%Reading package lists... 60%Reading package lists... 60%Reading package lists... 72%Reading package lists... 72%Reading package lists... 76%Reading package lists... 76%Reading package lists... 76%Reading package lists... 76%Reading package lists... 77%Reading package lists... 77%Reading package lists... 77%Reading package lists... 77%Reading package lists... 84%Reading package lists... 84%Reading package lists... 95%Reading package lists... 95%Reading package lists... 99%Reading package lists... 99%Reading package lists... 99%Reading package lists... 99%Reading package lists... Done
Building dependency tree... 0%Building dependency tree... 0%Building dependency tree... 50%Building dependency tree... 50%Building dependency tree... Done
Reading state information... 0% Reading state information... 3%Reading state information... Done
The following NEW packages will be installed:
  time
0 upgraded, 1 newly installed, 0 to remove and 0 not upgraded.
Need to get 46.7 kB of archives.
After this operation, 129 kB of additional disk space will be used.
0% [Working]            Get:1 http://archive.ubuntu.com/ubuntu jammy/main amd64 time amd64 1.9-0.1build2 [46.7 kB]
21% [1 time 12.3 kB/46.7 kB 26%]                                100% [Working]              Fetched 46.7 kB in 0s (287 kB/s)
debconf: delaying package configuration, since apt-utils is not installed
Selecting previously unselected package time.
(Reading database ... (Reading database ... 5%(Reading database ... 10%(Reading database ... 15%(Reading database ... 20%(Reading database ... 25%(Reading database ... 30%(Reading database ... 35%(Reading database ... 40%(Reading database ... 45%(Reading database ... 50%(Reading database ... 55%(Reading database ... 60%(Reading database ... 65%(Reading database ... 70%(Reading database ... 75%(Reading database ... 80%(Reading database ... 85%(Reading database ... 90%(Reading database ... 95%(Reading database ... 100%(Reading database ... 5195 files and directories currently installed.)
Preparing to unpack .../time_1.9-0.1build2_amd64.deb ...
Unpacking time (1.9-0.1build2) ...
Setting up time (1.9-0.1build2) ...
🚩️ Flux Option Flags defined
Command provided is: -o cpu-affinity=per-task --exclusive --cores-per-task 1 --env OMP_NUM_THREADS=1 /opt/view/bin/amg -n 128 128 128 -P 4 4 4 -problem 2
Flags for flux are -N 8 -n64  

🌀 Submit Mode: flux start -o --config /mnt/flux/view/etc/flux/config -Scron.directory=/etc/flux/system/cron.d   -Stbon.fanout=256   -Srundir=/mnt/flux/view/run/flux    -Sstatedir=/mnt/flux/view/var/lib/flux   -Slocal-uri=local:///mnt/flux/view/run/flux/local -Stbon.connect_timeout=5s    -Slog-stderr-level=6    -Slog-stderr-mode=local  flux submit  -N 8 -n64   --quiet --watch -o cpu-affinity=per-task --exclusive --cores-per-task 1 --env OMP_NUM_THREADS=1 /opt/view/bin/amg -n 128 128 128 -P 4 4 4 -problem 2
Flags for flux are -N 8 -n64  
broker.info[0]: start: none->join 0.52944ms
broker.info[0]: parent-none: join->init 0.02506ms
cron.info[0]: synchronizing cron tasks to event heartbeat.pulse
job-manager.info[0]: restart: 0 jobs
job-manager.info[0]: restart: 0 running jobs
job-manager.info[0]: restart: checkpoint.job-manager not found
broker.info[0]: rc1.0: running /opt/software/linux-ubuntu22.04-x86_64/gcc-11.4.0/flux-core-0.61.2-zpun7rhwtkelzplutv4nvzwj5ydo7h7p/etc/flux/rc1.d/02-cron
broker.info[0]: rc1.0: /opt/software/linux-ubuntu22.04-x86_64/gcc-11.4.0/flux-core-0.61.2-zpun7rhwtkelzplutv4nvzwj5ydo7h7p/etc/flux/rc1 Exited (rc=0) 1.0s
broker.info[0]: rc1-success: init->quorum 1.0368s
broker.info[0]: online: flux-sample-0 (ranks 0)
broker.info[0]: online: flux-sample-[0-7] (ranks 0-7)
broker.info[0]: quorum-full: quorum->run 2.78335s
Running with these driver parameters:
  Problem ID    = 2

=============================================
Hypre init times:
=============================================
Hypre init:
  wall clock time = 0.000019 seconds
  Laplacian_7pt:
    (Nx, Ny, Nz) = (512, 512, 512)
    (Px, Py, Pz) = (4, 4, 4)

=============================================
Generate Matrix:
=============================================
Spatial Operator:
  wall clock time = 2.632655 seconds
  RHS vector has unit components
  Initial guess is 0
=============================================
IJ Vector Setup:
=============================================
RHS and Initial Guess:
  wall clock time = 0.054827 seconds
=============================================
Problem 2: AMG Setup Time:
=============================================
PCG Setup:
  wall clock time = 13.523121 seconds

FOM_Setup: nnz_AP / Setup Phase Time: 1.201801e+08

=============================================
Problem 2: AMG-PCG Solve Time:
=============================================
PCG Solve:
  wall clock time = 12.146337 seconds

Iterations = 23
Final Relative Residual Norm = 9.946909e-09


FOM_Solve: nnz_AP * iterations / Solve Phase Time: 1.338025e+08



Figure of Merit (FOM): nnz_AP / (Setup Phase Time + 3 * Solve Phase Time) 3.252884e+07

FLUXTIME fluxsubmit wall time 0:29.43
broker.info[0]: rc2.0: /usr/bin/time -f FLUXTIME fluxsubmit wall time %E flux submit -N 8 -n64 --quiet --watch -o cpu-affinity=per-task --exclusive --cores-per-task 1 --env OMP_NUM_THREADS=1 /opt/view/bin/amg -n 128 128 128 -P 4 4 4 -problem 2 Exited (rc=0) 29.4s
broker.info[0]: rc2-success: run->cleanup 29.4424s
broker.info[0]: cleanup.0: flux jobtap remove perilog 2>/dev/null || true Exited (rc=0) 0.1s
broker.info[0]: cleanup.1: flux queue stop --quiet --all --nocheckpoint Exited (rc=0) 0.2s
broker.info[0]: cleanup.2: flux cancel --user=all --quiet --states RUN Exited (rc=0) 0.2s
broker.info[0]: cleanup.3: flux queue idle --quiet Exited (rc=0) 0.2s
broker.info[0]: cleanup-success: cleanup->shutdown 0.625709s
broker.info[0]: children-complete: shutdown->finalize 0.148323s
broker.info[0]: rc3.0: /opt/software/linux-ubuntu22.04-x86_64/gcc-11.4.0/flux-core-0.61.2-zpun7rhwtkelzplutv4nvzwj5ydo7h7p/etc/flux/rc3 Exited (rc=0) 0.2s
broker.info[0]: rc3-success: finalize->goodbye 0.250173s
broker.info[0]: goodbye: goodbye->exit 0.088955ms
FLUXTIME fluxstart wall time 0:34.30
