/usr/bin/time is required to use logging.timed true

Flux install root: /mnt/flux/view

🟧️  wait-fs: 2024/10/04 18:15:49 wait-fs.go:40: /mnt/flux/flux-operator-done.txt
🟧️  wait-fs: 2024/10/04 18:15:49 wait-fs.go:49: Found existing path /mnt/flux/flux-operator-done.txt
Python version: /mnt/flux/view/bin/python3.11
Python root: /mnt/flux/view/lib/python3.11
PYTHONPATH is :/mnt/flux/view/lib/python3.11/site-packages
PATH is /usr/local/sbin:/usr/local/bin:/usr/sbin:/usr/bin:/sbin:/bin:/mnt/flux/view/bin
/mnt/flux/view/lib/libpython3.so
/mnt/flux/view/lib/libpython3.11.so
/mnt/flux/view/lib/libpython3.11.so.1.0
./mnt/flux/view/lib/libpython3.so
./mnt/flux/view/lib/libpython3.11.so
./mnt/flux/view/lib/libpython3.11.so.1.0
./mnt/flux/software/linux-ubuntu22.04-x86_64/gcc-11.4.0/python-3.11.7-dne37dvjelr7oaag76ipidxkt5uyr5is/lib/libpython3.so
./mnt/flux/software/linux-ubuntu22.04-x86_64/gcc-11.4.0/python-3.11.7-dne37dvjelr7oaag76ipidxkt5uyr5is/lib/libpython3.11.so
./mnt/flux/software/linux-ubuntu22.04-x86_64/gcc-11.4.0/python-3.11.7-dne37dvjelr7oaag76ipidxkt5uyr5is/lib/libpython3.11.so.1.0
./opt/software/linux-ubuntu22.04-x86_64/gcc-11.4.0/python-3.11.7-dne37dvjelr7oaag76ipidxkt5uyr5is/lib/libpython3.so
./opt/software/linux-ubuntu22.04-x86_64/gcc-11.4.0/python-3.11.7-dne37dvjelr7oaag76ipidxkt5uyr5is/lib/libpython3.11.so
./opt/software/linux-ubuntu22.04-x86_64/gcc-11.4.0/python-3.11.7-dne37dvjelr7oaag76ipidxkt5uyr5is/lib/libpython3.11.so.1.0
lrwxrwxrwx 1 root root 121 Oct  4 18:15 /mnt/flux/view/lib/libpython3.11.so.1.0 -> /opt/software/linux-ubuntu22.04-x86_64/gcc-11.4.0/python-3.11.7-dne37dvjelr7oaag76ipidxkt5uyr5is/lib/libpython3.11.so.1.0

Hello user root

🌟️ Curve Certificate
curve.cert
#   ****  Generated on 2023-04-26 22:54:42 by CZMQ  ****
#   ZeroMQ CURVE **Secret** Certificate
#   DO NOT PROVIDE THIS FILE TO OTHER USERS nor change its permissions.
    
metadata
    name = "flux-cert-generator"
    keygen.hostname = "flux-sample-0"
curve
    public-key = "=FQ*YJ71Z9a@*JOz7KJ>h{#uW]*L3i8vwUA<xsxj"
    secret-key = "fm#D=r5pFyqu(<[bw#XFEwfJ7?==vK<HC45yzTY!"
👋 Hello, I'm flux-sample-0
The main host is flux-sample-0
The working directory is /, contents include:
bin   dev  flux_operator  lib	 lib64	 media	opt   root  sbin  sys  usr
boot  etc  home		  lib32  libx32  mnt	proc  run   srv   tmp  var
0% [Working]            Get:1 http://security.ubuntu.com/ubuntu jammy-security InRelease [129 kB]
0% [Waiting for headers] [1 InRelease 11.0 kB/129 kB 8%]                                                        Get:2 http://archive.ubuntu.com/ubuntu jammy InRelease [270 kB]
0% [2 InRelease 13.8 kB/270 kB 5%] [1 InRelease 60.2 kB/129 kB 47%]                                                                   0% [2 InRelease 16.6 kB/270 kB 6%]0% [2 InRelease 70.1 kB/270 kB 26%]                                   Get:3 http://security.ubuntu.com/ubuntu jammy-security/multiverse amd64 Packages [44.7 kB]
0% [2 InRelease 95.4 kB/270 kB 35%] [3 Packages 12.5 kB/44.7 kB 28%]                                                                    0% [2 InRelease 129 kB/270 kB 48%]0% [3 Packages store 0 B] [2 InRelease 129 kB/270 kB 48%] [Waiting for headers]                                                                               0% [2 InRelease 132 kB/270 kB 49%] [Waiting for headers]                                                        Get:4 http://security.ubuntu.com/ubuntu jammy-security/universe amd64 Packages [1159 kB]
0% [2 InRelease 163 kB/270 kB 60%] [4 Packages 2605 B/1159 kB 0%]                                                                 0% [4 Packages 77.2 kB/1159 kB 7%]                                  Get:5 http://archive.ubuntu.com/ubuntu jammy-updates InRelease [128 kB]
0% [5 InRelease 2508 B/128 kB 2%] [4 Packages 201 kB/1159 kB 17%]                                                                 0% [4 Packages 263 kB/1159 kB 23%]0% [Waiting for headers] [4 Packages 393 kB/1159 kB 34%]                                                        Get:6 http://archive.ubuntu.com/ubuntu jammy-backports InRelease [127 kB]
0% [6 InRelease 2508 B/127 kB 2%] [4 Packages 460 kB/1159 kB 40%]                                                                 0% [4 Packages 548 kB/1159 kB 47%]0% [Waiting for headers] [4 Packages 866 kB/1159 kB 75%]                                                        Get:7 http://archive.ubuntu.com/ubuntu jammy/restricted amd64 Packages [164 kB]
0% [7 Packages 2577 B/164 kB 2%] [4 Packages 874 kB/1159 kB 75%]                                                                0% [Waiting for headers] [4 Packages 1054 kB/1159 kB 91%]                                                         Get:8 http://archive.ubuntu.com/ubuntu jammy/multiverse amd64 Packages [266 kB]
0% [8 Packages 2836 B/266 kB 1%] [4 Packages 1054 kB/1159 kB 91%]0% [7 Packages store 0 B] [8 Packages 4244 B/266 kB 2%] [4 Packages 1054 kB/115                                                                               0% [8 Packages 45.6 kB/266 kB 17%] [4 Packages 1105 kB/1159 kB 95%]                                                                   0% [8 Packages 144 kB/266 kB 54%] [Waiting for headers]                                                       Get:9 http://security.ubuntu.com/ubuntu jammy-security/restricted amd64 Packages [3113 kB]
0% [8 Packages 147 kB/266 kB 55%] [9 Packages 68.1 kB/3113 kB 2%]0% [4 Packages store 0 B] [8 Packages 147 kB/266 kB 55%] [9 Packages 68.1 kB/31                                                                               0% [4 Packages store 0 B] [Waiting for headers] [9 Packages 288 kB/3113 kB 9%]                                                                              Get:10 http://archive.ubuntu.com/ubuntu jammy/universe amd64 Packages [17.5 MB]
0% [4 Packages store 0 B] [10 Packages 23.3 kB/17.5 MB 0%] [9 Packages 288 kB/3                                                                               0% [10 Packages 125 kB/17.5 MB 1%] [9 Packages 418 kB/3113 kB 13%]0% [8 Packages store 0 B] [10 Packages 125 kB/17.5 MB 1%] [9 Packages 418 kB/31                                                                               0% [10 Packages 175 kB/17.5 MB 1%] [9 Packages 487 kB/3113 kB 16%]22% [10 Packages 226 kB/17.5 MB 1%] [9 Packages 551 kB/3113 kB 18%]41% [10 Packages 5857 kB/17.5 MB 34%] [9 Packages 3113 kB/3113 kB 100%]                                                                       46% [10 Packages 7979 kB/17.5 MB 46%] [Waiting for headers]                                                           Get:11 http://security.ubuntu.com/ubuntu jammy-security/main amd64 Packages [2318 kB]
46% [10 Packages 7995 kB/17.5 MB 46%] [11 Packages 135 kB/2318 kB 6%]46% [9 Packages store 0 B] [10 Packages 7995 kB/17.5 MB 46%] [11 Packages 135 k                                                                               62% [10 Packages 12.3 MB/17.5 MB 71%] [11 Packages 2318 kB/2318 kB 100%]                                                                        62% [10 Packages 12.6 MB/17.5 MB 72%]62% [11 Packages store 0 B] [10 Packages 12.6 MB/17.5 MB 72%]                                                             74% [10 Packages 17.2 MB/17.5 MB 98%]                                     74% [Waiting for headers]                         Get:12 http://archive.ubuntu.com/ubuntu jammy/main amd64 Packages [1792 kB]
74% [12 Packages 118 kB/1792 kB 7%]75% [10 Packages store 0 B] [12 Packages 150 kB/1792 kB 8%]                                                           78% [10 Packages store 0 B] [Waiting for headers]                                                 Get:13 http://archive.ubuntu.com/ubuntu jammy-updates/main amd64 Packages [2596 kB]
79% [10 Packages store 0 B] [13 Packages 95.2 kB/2596 kB 4%]                                                            84% [10 Packages store 0 B] [Waiting for headers]                                                 Get:14 http://archive.ubuntu.com/ubuntu jammy-updates/multiverse amd64 Packages [51.8 kB]
84% [10 Packages store 0 B] [Waiting for headers]                                                 Get:15 http://archive.ubuntu.com/ubuntu jammy-updates/restricted amd64 Packages [3191 kB]
85% [10 Packages store 0 B] [15 Packages 116 kB/3191 kB 4%]                                                           92% [10 Packages store 0 B] [Waiting for headers]                                                 Get:16 http://archive.ubuntu.com/ubuntu jammy-updates/universe amd64 Packages [1447 kB]
92% [10 Packages store 0 B] [16 Packages 201 kB/1447 kB 14%]                                                            95% [10 Packages store 0 B] [Waiting for headers]                                                 Get:17 http://archive.ubuntu.com/ubuntu jammy-backports/universe amd64 Packages [33.7 kB]
                                                 Get:18 http://archive.ubuntu.com/ubuntu jammy-backports/main amd64 Packages [81.4 kB]
96% [10 Packages store 0 B] [18 Packages 81.4 kB/81.4 kB 100%]                                                              96% [10 Packages store 0 B]96% [10 Packages store 0 B]                           96% [Working]96% [12 Packages store 0 B]                           97% [Working]97% [13 Packages store 0 B]                           97% [Working]97% [14 Packages store 0 B]                           98% [Working]98% [15 Packages store 0 B]                           98% [Working]98% [16 Packages store 0 B]                           99% [Working]99% [17 Packages store 0 B]                           99% [Working]99% [18 Packages store 0 B]                           100% [Working]              Fetched 34.4 MB in 5s (7033 kB/s)
Reading package lists... 0%Reading package lists... 0%Reading package lists... 0%Reading package lists... 4%Reading package lists... 4%Reading package lists... 5%Reading package lists... 5%Reading package lists... 52%Reading package lists... 52%Reading package lists... 53%Reading package lists... 53%Reading package lists... 55%Reading package lists... 61%Reading package lists... 61%Reading package lists... 72%Reading package lists... 72%Reading package lists... 77%Reading package lists... 77%Reading package lists... 77%Reading package lists... 77%Reading package lists... 77%Reading package lists... 77%Reading package lists... 77%Reading package lists... 77%Reading package lists... 85%Reading package lists... 85%Reading package lists... 95%Reading package lists... 95%Reading package lists... 99%Reading package lists... 99%Reading package lists... 99%Reading package lists... 99%Reading package lists... Done
Reading package lists... 0%Reading package lists... 0%Reading package lists... 0%Reading package lists... 4%Reading package lists... 4%Reading package lists... 5%Reading package lists... 5%Reading package lists... 52%Reading package lists... 52%Reading package lists... 53%Reading package lists... 53%Reading package lists... 56%Reading package lists... 61%Reading package lists... 61%Reading package lists... 72%Reading package lists... 72%Reading package lists... 77%Reading package lists... 77%Reading package lists... 77%Reading package lists... 77%Reading package lists... 77%Reading package lists... 77%Reading package lists... 77%Reading package lists... 77%Reading package lists... 85%Reading package lists... 85%Reading package lists... 95%Reading package lists... 95%Reading package lists... 99%Reading package lists... 99%Reading package lists... 99%Reading package lists... 99%Reading package lists... Done
Building dependency tree... 0%Building dependency tree... 0%Building dependency tree... 50%Building dependency tree... 50%Building dependency tree... Done
Reading state information... 0% Reading state information... 3%Reading state information... Done
The following NEW packages will be installed:
  time
0 upgraded, 1 newly installed, 0 to remove and 0 not upgraded.
Need to get 46.7 kB of archives.
After this operation, 129 kB of additional disk space will be used.
0% [Working]            Get:1 http://archive.ubuntu.com/ubuntu jammy/main amd64 time amd64 1.9-0.1build2 [46.7 kB]
24% [1 time 13.8 kB/46.7 kB 30%]                                100% [Working]              Fetched 46.7 kB in 0s (244 kB/s)
debconf: delaying package configuration, since apt-utils is not installed
Selecting previously unselected package time.
(Reading database ... (Reading database ... 5%(Reading database ... 10%(Reading database ... 15%(Reading database ... 20%(Reading database ... 25%(Reading database ... 30%(Reading database ... 35%(Reading database ... 40%(Reading database ... 45%(Reading database ... 50%(Reading database ... 55%(Reading database ... 60%(Reading database ... 65%(Reading database ... 70%(Reading database ... 75%(Reading database ... 80%(Reading database ... 85%(Reading database ... 90%(Reading database ... 95%(Reading database ... 100%(Reading database ... 5195 files and directories currently installed.)
Preparing to unpack .../time_1.9-0.1build2_amd64.deb ...
Unpacking time (1.9-0.1build2) ...
Setting up time (1.9-0.1build2) ...
🚩️ Flux Option Flags defined
Command provided is: -o cpu-affinity=per-task /opt/view/bin/miniFE.x nx=230 ny=230 nz=230 use_locking=1 elem_group_size=10 use_elem_mat_fields=300 verify_solution=0
Flags for flux are -N 64 -n512  

🌀 Submit Mode: flux start -o --config /mnt/flux/view/etc/flux/config -Scron.directory=/etc/flux/system/cron.d   -Stbon.fanout=256   -Srundir=/mnt/flux/view/run/flux    -Sstatedir=/mnt/flux/view/var/lib/flux   -Slocal-uri=local:///mnt/flux/view/run/flux/local -Stbon.connect_timeout=5s    -Slog-stderr-level=6    -Slog-stderr-mode=local  flux submit  -N 64 -n512   --quiet --watch -o cpu-affinity=per-task /opt/view/bin/miniFE.x nx=230 ny=230 nz=230 use_locking=1 elem_group_size=10 use_elem_mat_fields=300 verify_solution=0
Flags for flux are -N 64 -n512  
broker.info[0]: start: none->join 0.492145ms
broker.info[0]: parent-none: join->init 0.0257ms
cron.info[0]: synchronizing cron tasks to event heartbeat.pulse
job-manager.info[0]: restart: 0 jobs
job-manager.info[0]: restart: 0 running jobs
job-manager.info[0]: restart: checkpoint.job-manager not found
broker.info[0]: rc1.0: running /opt/software/linux-ubuntu22.04-x86_64/gcc-11.4.0/flux-core-0.61.2-zpun7rhwtkelzplutv4nvzwj5ydo7h7p/etc/flux/rc1.d/02-cron
broker.info[0]: rc1.0: /opt/software/linux-ubuntu22.04-x86_64/gcc-11.4.0/flux-core-0.61.2-zpun7rhwtkelzplutv4nvzwj5ydo7h7p/etc/flux/rc1 Exited (rc=0) 1.1s
broker.info[0]: rc1-success: init->quorum 1.11133s
broker.info[0]: online: flux-sample-0 (ranks 0)
broker.info[0]: online: flux-sample-[0-5,7-53,55-63] (ranks 0-5,7-53,55-63)
broker.info[0]: online: flux-sample-[0-53,55-63] (ranks 0-53,55-63)
broker.info[0]: online: flux-sample-[0-63] (ranks 0-63)
broker.info[0]: quorum-full: quorum->run 19.7208s
      creating/filling mesh...0.026263s, total time: 0.026263
generating matrix structure...0.076828s, total time: 0.103091
         assembling FE data...0.062259s, total time: 0.16535
      imposing Dirichlet BC...0.01055s, total time: 0.1759
      imposing Dirichlet BC...0.000945091s, total time: 0.176845
making matrix indices local...0.218053s, total time: 0.394898
Starting CG solver ... 
Initial Residual = 231.002
Iteration = 20   Residual = 0.356203
Iteration = 40   Residual = 0.0394941
Iteration = 60   Residual = 0.0152524
Iteration = 80   Residual = 0.0100926
Iteration = 100   Residual = 0.00715704
Iteration = 120   Residual = 0.00520376
Iteration = 140   Residual = 0.00379864
Iteration = 160   Residual = 0.00271983
Iteration = 180   Residual = 0.00192086
Iteration = 200   Residual = 0.0013501
Final Resid Norm: 0.0013501
FLUXTIME fluxsubmit wall time 0:11.13
broker.info[0]: rc2.0: /usr/bin/time -f FLUXTIME fluxsubmit wall time %E flux submit -N 64 -n512 --quiet --watch -o cpu-affinity=per-task /opt/view/bin/miniFE.x nx=230 ny=230 nz=230 use_locking=1 elem_group_size=10 use_elem_mat_fields=300 verify_solution=0 Exited (rc=0) 11.1s
broker.info[0]: rc2-success: run->cleanup 11.1436s
broker.info[0]: cleanup.0: flux jobtap remove perilog 2>/dev/null || true Exited (rc=0) 0.2s
broker.info[0]: cleanup.1: flux queue stop --quiet --all --nocheckpoint Exited (rc=0) 0.2s
broker.info[0]: cleanup.2: flux cancel --user=all --quiet --states RUN Exited (rc=0) 0.2s
broker.info[0]: cleanup.3: flux queue idle --quiet Exited (rc=0) 0.2s
broker.info[0]: cleanup-success: cleanup->shutdown 0.655972s
broker.err[0]: flux-sample-3 (rank 3) transitioning to full->LOST after 32s due to EHOSTUNREACH error on send
broker.err[0]: flux-sample-22 (rank 22) transitioning to full->LOST after 32s due to EHOSTUNREACH error on send
broker.err[0]: flux-sample-30 (rank 30) transitioning to full->LOST after 32s due to EHOSTUNREACH error on send
broker.err[0]: flux-sample-32 (rank 32) transitioning to full->LOST after 32s due to EHOSTUNREACH error on send
broker.err[0]: flux-sample-37 (rank 37) transitioning to full->LOST after 32s due to EHOSTUNREACH error on send
broker.err[0]: flux-sample-51 (rank 51) transitioning to full->LOST after 32s due to EHOSTUNREACH error on send
broker.err[0]: flux-sample-53 (rank 53) transitioning to full->LOST after 32s due to EHOSTUNREACH error on send
broker.err[0]: flux-sample-39 (rank 39) transitioning to full->LOST after 28s due to EHOSTUNREACH error on send
broker.err[0]: flux-sample-59 (rank 59) transitioning to full->LOST after 32s due to EHOSTUNREACH error on send
broker.err[0]: flux-sample-48 (rank 48) transitioning to full->LOST after 31s due to EHOSTUNREACH error on send
broker.err[0]: flux-sample-43 (rank 43) transitioning to full->LOST after 30s due to EHOSTUNREACH error on send
broker.err[0]: flux-sample-55 (rank 55) transitioning to full->LOST after 28s due to EHOSTUNREACH error on send
broker.info[0]: children-complete: shutdown->finalize 0.26463s
broker.info[0]: rc3.0: /opt/software/linux-ubuntu22.04-x86_64/gcc-11.4.0/flux-core-0.61.2-zpun7rhwtkelzplutv4nvzwj5ydo7h7p/etc/flux/rc3 Exited (rc=0) 0.3s
broker.info[0]: rc3-success: finalize->goodbye 0.272493s
broker.info[0]: goodbye: goodbye->exit 0.075473ms
FLUXTIME fluxstart wall time 0:33.19
