/usr/bin/time is required to use logging.timed true

Flux install root: /mnt/flux/view

🟧️  wait-fs: 2024/10/04 02:09:33 wait-fs.go:40: /mnt/flux/flux-operator-done.txt
🟧️  wait-fs: 2024/10/04 02:09:33 wait-fs.go:49: Found existing path /mnt/flux/flux-operator-done.txt
Python version: /mnt/flux/view/bin/python3.11
Python root: /mnt/flux/view/lib/python3.11
PYTHONPATH is :/mnt/flux/view/lib/python3.11/site-packages
PATH is /usr/local/sbin:/usr/local/bin:/usr/sbin:/usr/bin:/sbin:/bin:/mnt/flux/view/bin
/mnt/flux/view/lib/libpython3.so
/mnt/flux/view/lib/libpython3.11.so
/mnt/flux/view/lib/libpython3.11.so.1.0
./mnt/flux/view/lib/libpython3.so
./mnt/flux/view/lib/libpython3.11.so
./mnt/flux/view/lib/libpython3.11.so.1.0
./mnt/flux/software/linux-ubuntu22.04-x86_64/gcc-11.4.0/python-3.11.7-dne37dvjelr7oaag76ipidxkt5uyr5is/lib/libpython3.so
./mnt/flux/software/linux-ubuntu22.04-x86_64/gcc-11.4.0/python-3.11.7-dne37dvjelr7oaag76ipidxkt5uyr5is/lib/libpython3.11.so
./mnt/flux/software/linux-ubuntu22.04-x86_64/gcc-11.4.0/python-3.11.7-dne37dvjelr7oaag76ipidxkt5uyr5is/lib/libpython3.11.so.1.0
./opt/software/linux-ubuntu22.04-x86_64/gcc-11.4.0/python-3.11.7-dne37dvjelr7oaag76ipidxkt5uyr5is/lib/libpython3.so
./opt/software/linux-ubuntu22.04-x86_64/gcc-11.4.0/python-3.11.7-dne37dvjelr7oaag76ipidxkt5uyr5is/lib/libpython3.11.so
./opt/software/linux-ubuntu22.04-x86_64/gcc-11.4.0/python-3.11.7-dne37dvjelr7oaag76ipidxkt5uyr5is/lib/libpython3.11.so.1.0
lrwxrwxrwx 1 root root 121 Oct  4 02:09 /mnt/flux/view/lib/libpython3.11.so.1.0 -> /opt/software/linux-ubuntu22.04-x86_64/gcc-11.4.0/python-3.11.7-dne37dvjelr7oaag76ipidxkt5uyr5is/lib/libpython3.11.so.1.0

Hello user root

🌟️ Curve Certificate
curve.cert
#   ****  Generated on 2023-04-26 22:54:42 by CZMQ  ****
#   ZeroMQ CURVE **Secret** Certificate
#   DO NOT PROVIDE THIS FILE TO OTHER USERS nor change its permissions.
    
metadata
    name = "flux-cert-generator"
    keygen.hostname = "flux-sample-0"
curve
    public-key = "D%JXM3c%c3sq=BLRX>0c4(3h]h#!T8gJd0eEM%8W"
    secret-key = "R&0E7*H4YV1h*OG-g-*<NCQwiMwynWcH5Wsxkrq4"
👋 Hello, I'm flux-sample-0
The main host is flux-sample-0
The working directory is /, contents include:
bin   dev  flux_operator  lib	 lib64	 media	opt   root  sbin  sys  usr
boot  etc  home		  lib32  libx32  mnt	proc  run   srv   tmp  var
0% [Working]            Get:1 http://security.ubuntu.com/ubuntu jammy-security InRelease [129 kB]
0% [Connecting to archive.ubuntu.com] [1 InRelease 5321 B/129 kB 4%]                                                                    0% [Connecting to archive.ubuntu.com (185.125.190.83)]                                                      0% [Waiting for headers]                        Get:2 http://security.ubuntu.com/ubuntu jammy-security/universe amd64 Packages [1159 kB]
0% [Waiting for headers] [2 Packages 4013 B/1159 kB 0%]                                                       Get:3 http://archive.ubuntu.com/ubuntu jammy InRelease [270 kB]
0% [3 InRelease 8140 B/270 kB 3%] [2 Packages 84.3 kB/1159 kB 7%]                                                                 0% [3 InRelease 13.8 kB/270 kB 5%]0% [2 Packages store 0 B] [3 InRelease 13.8 kB/270 kB 5%] [Waiting for headers]                                                                               Get:4 http://security.ubuntu.com/ubuntu jammy-security/multiverse amd64 Packages [44.7 kB]
0% [2 Packages store 0 B] [3 InRelease 26.4 kB/270 kB 10%] [4 Packages 22.4 kB/0% [2 Packages store 0 B] [3 InRelease 26.4 kB/270 kB 10%] [Waiting for headers                                                                               Get:5 http://security.ubuntu.com/ubuntu jammy-security/main amd64 Packages [2318 kB]
0% [2 Packages store 0 B] [3 InRelease 26.4 kB/270 kB 10%] [5 Packages 23.7 kB/                                                                               0% [3 InRelease 33.5 kB/270 kB 12%] [5 Packages 1851 kB/2318 kB 80%]0% [4 Packages store 0 B] [3 InRelease 33.5 kB/270 kB 12%] [5 Packages 1865 kB/                                                                               0% [3 InRelease 33.5 kB/270 kB 12%] [5 Packages 2037 kB/2318 kB 88%]                                                                    0% [3 InRelease 33.5 kB/270 kB 12%] [Waiting for headers]                                                         Get:6 http://security.ubuntu.com/ubuntu jammy-security/restricted amd64 Packages [3113 kB]
0% [3 InRelease 33.5 kB/270 kB 12%] [6 Packages 18.1 kB/3113 kB 1%]0% [5 Packages store 0 B] [3 InRelease 33.5 kB/270 kB 12%] [6 Packages 40.9 kB/                                                                               0% [5 Packages store 0 B] [3 InRelease 37.7 kB/270 kB 14%]                                                          0% [3 InRelease 72.9 kB/270 kB 27%]0% [6 Packages store 0 B] [3 InRelease 72.9 kB/270 kB 27%]                                                          0% [3 InRelease 224 kB/270 kB 83%]                                  0% [Working]0% [Waiting for headers]                        Get:7 http://archive.ubuntu.com/ubuntu jammy-updates InRelease [128 kB]
0% [7 InRelease 2506 B/128 kB 2%]                                 0% [Working]0% [Waiting for headers]                        Get:8 http://archive.ubuntu.com/ubuntu jammy-backports InRelease [127 kB]
0% [8 InRelease 2508 B/127 kB 2%]                                 0% [Working]31% [Waiting for headers]                         Get:9 http://archive.ubuntu.com/ubuntu jammy/main amd64 Packages [1792 kB]
31% [9 Packages 2575 B/1792 kB 0%]                                  36% [Waiting for headers]                         Get:10 http://archive.ubuntu.com/ubuntu jammy/universe amd64 Packages [17.5 MB]
36% [10 Packages 8135 B/17.5 MB 0%]36% [9 Packages store 0 B] [10 Packages 8135 B/17.5 MB 0%]                                                          40% [10 Packages 1727 kB/17.5 MB 10%]70% [10 Packages 14.6 MB/17.5 MB 84%]                                     77% [Waiting for headers]                         Get:11 http://archive.ubuntu.com/ubuntu jammy/restricted amd64 Packages [164 kB]
77% [11 Packages 28.7 kB/164 kB 17%]77% [10 Packages store 0 B] [11 Packages 66.8 kB/164 kB 41%]                                                            77% [10 Packages store 0 B] [Waiting for headers]                                                 Get:12 http://archive.ubuntu.com/ubuntu jammy/multiverse amd64 Packages [266 kB]
77% [10 Packages store 0 B] [12 Packages 33.4 kB/266 kB 13%]                                                            78% [10 Packages store 0 B] [Waiting for headers]                                                 Get:13 http://archive.ubuntu.com/ubuntu jammy-updates/universe amd64 Packages [1447 kB]
78% [10 Packages store 0 B] [13 Packages 0 B/1447 kB 0%]                                                        81% [10 Packages store 0 B] [Waiting for headers]                                                 Get:14 http://archive.ubuntu.com/ubuntu jammy-updates/restricted amd64 Packages [3191 kB]
81% [10 Packages store 0 B] [14 Packages 20.5 kB/3191 kB 1%]                                                            89% [10 Packages store 0 B] [Waiting for headers]                                                 Get:15 http://archive.ubuntu.com/ubuntu jammy-updates/multiverse amd64 Packages [51.8 kB]
89% [10 Packages store 0 B] [15 Packages 32.8 kB/51.8 kB 63%]                                                             89% [10 Packages store 0 B] [Waiting for headers]                                                 Get:16 http://archive.ubuntu.com/ubuntu jammy-updates/main amd64 Packages [2596 kB]
89% [10 Packages store 0 B] [16 Packages 45.1 kB/2596 kB 2%]                                                            95% [10 Packages store 0 B] [Waiting for headers]                                                 Get:17 http://archive.ubuntu.com/ubuntu jammy-backports/universe amd64 Packages [33.7 kB]
95% [10 Packages store 0 B] [17 Packages 17.1 kB/33.7 kB 51%]                                                             95% [10 Packages store 0 B] [Waiting for headers]                                                 Get:18 http://archive.ubuntu.com/ubuntu jammy-backports/main amd64 Packages [81.4 kB]
95% [10 Packages store 0 B] [18 Packages 33.6 kB/81.4 kB 41%]                                                             95% [10 Packages store 0 B]95% [10 Packages store 0 B]                           96% [Working]96% [11 Packages store 0 B]                           96% [Working]96% [12 Packages store 0 B]                           97% [Working]97% [13 Packages store 0 B]                           97% [Working]97% [14 Packages store 0 B]                           98% [Working]98% [15 Packages store 0 B]                           98% [Working]98% [16 Packages store 0 B]                           99% [Working]99% [17 Packages store 0 B]                           99% [Working]99% [18 Packages store 0 B]                           100% [Working]              Fetched 34.4 MB in 4s (9198 kB/s)
Reading package lists... 0%Reading package lists... 0%Reading package lists... 0%Reading package lists... 4%Reading package lists... 4%Reading package lists... 5%Reading package lists... 5%Reading package lists... 52%Reading package lists... 52%Reading package lists... 53%Reading package lists... 53%Reading package lists... 61%Reading package lists... 61%Reading package lists... 61%Reading package lists... 72%Reading package lists... 72%Reading package lists... 77%Reading package lists... 77%Reading package lists... 77%Reading package lists... 77%Reading package lists... 77%Reading package lists... 77%Reading package lists... 77%Reading package lists... 77%Reading package lists... 85%Reading package lists... 85%Reading package lists... 95%Reading package lists... 95%Reading package lists... 99%Reading package lists... 99%Reading package lists... 99%Reading package lists... 99%Reading package lists... Done
Reading package lists... 0%Reading package lists... 0%Reading package lists... 0%Reading package lists... 4%Reading package lists... 4%Reading package lists... 5%Reading package lists... 5%Reading package lists... 52%Reading package lists... 52%Reading package lists... 53%Reading package lists... 53%Reading package lists... 61%Reading package lists... 61%Reading package lists... 61%Reading package lists... 72%Reading package lists... 72%Reading package lists... 77%Reading package lists... 77%Reading package lists... 77%Reading package lists... 77%Reading package lists... 77%Reading package lists... 77%Reading package lists... 77%Reading package lists... 77%Reading package lists... 85%Reading package lists... 85%Reading package lists... 95%Reading package lists... 95%Reading package lists... 99%Reading package lists... 99%Reading package lists... 99%Reading package lists... 99%Reading package lists... Done
Building dependency tree... 0%Building dependency tree... 0%Building dependency tree... 50%Building dependency tree... 50%Building dependency tree... Done
Reading state information... 0% Reading state information... 3%Reading state information... Done
The following NEW packages will be installed:
  time
0 upgraded, 1 newly installed, 0 to remove and 0 not upgraded.
Need to get 46.7 kB of archives.
After this operation, 129 kB of additional disk space will be used.
0% [Working]            Get:1 http://archive.ubuntu.com/ubuntu jammy/main amd64 time amd64 1.9-0.1build2 [46.7 kB]
14% [1 time 8158 B/46.7 kB 17%]                               100% [Working]              Fetched 46.7 kB in 0s (93.8 kB/s)
debconf: delaying package configuration, since apt-utils is not installed
Selecting previously unselected package time.
(Reading database ... (Reading database ... 5%(Reading database ... 10%(Reading database ... 15%(Reading database ... 20%(Reading database ... 25%(Reading database ... 30%(Reading database ... 35%(Reading database ... 40%(Reading database ... 45%(Reading database ... 50%(Reading database ... 55%(Reading database ... 60%(Reading database ... 65%(Reading database ... 70%(Reading database ... 75%(Reading database ... 80%(Reading database ... 85%(Reading database ... 90%(Reading database ... 95%(Reading database ... 100%(Reading database ... 5195 files and directories currently installed.)
Preparing to unpack .../time_1.9-0.1build2_amd64.deb ...
Unpacking time (1.9-0.1build2) ...
Setting up time (1.9-0.1build2) ...
🚩️ Flux Option Flags defined
Command provided is: -o cpu-affinity=per-task /opt/view/bin/miniFE.x nx=230 ny=230 nz=230 use_locking=1 elem_group_size=10 use_elem_mat_fields=300 verify_solution=0
Flags for flux are -N 4 -n32  

🌀 Submit Mode: flux start -o --config /mnt/flux/view/etc/flux/config -Scron.directory=/etc/flux/system/cron.d   -Stbon.fanout=256   -Srundir=/mnt/flux/view/run/flux    -Sstatedir=/mnt/flux/view/var/lib/flux   -Slocal-uri=local:///mnt/flux/view/run/flux/local -Stbon.connect_timeout=5s    -Slog-stderr-level=6    -Slog-stderr-mode=local  flux submit  -N 4 -n32   --quiet --watch -o cpu-affinity=per-task /opt/view/bin/miniFE.x nx=230 ny=230 nz=230 use_locking=1 elem_group_size=10 use_elem_mat_fields=300 verify_solution=0
Flags for flux are -N 4 -n32  
broker.info[0]: start: none->join 0.674738ms
broker.info[0]: parent-none: join->init 0.029279ms
cron.info[0]: synchronizing cron tasks to event heartbeat.pulse
job-manager.info[0]: restart: 0 jobs
job-manager.info[0]: restart: 0 running jobs
job-manager.info[0]: restart: checkpoint.job-manager not found
broker.info[0]: rc1.0: running /opt/software/linux-ubuntu22.04-x86_64/gcc-11.4.0/flux-core-0.61.2-zpun7rhwtkelzplutv4nvzwj5ydo7h7p/etc/flux/rc1.d/02-cron
broker.info[0]: rc1.0: /opt/software/linux-ubuntu22.04-x86_64/gcc-11.4.0/flux-core-0.61.2-zpun7rhwtkelzplutv4nvzwj5ydo7h7p/etc/flux/rc1 Exited (rc=0) 0.9s
broker.info[0]: rc1-success: init->quorum 0.921452s
broker.info[0]: online: flux-sample-0 (ranks 0)
broker.info[0]: online: flux-sample-[0-3] (ranks 0-3)
broker.info[0]: quorum-full: quorum->run 1.45924s
      creating/filling mesh...0.0254991s, total time: 0.0254991
generating matrix structure...0.563341s, total time: 0.58884
         assembling FE data...0.935399s, total time: 1.52424
      imposing Dirichlet BC...0.174981s, total time: 1.69922
      imposing Dirichlet BC...0.0138519s, total time: 1.71307
making matrix indices local...0.641307s, total time: 2.35438
Starting CG solver ... 
Initial Residual = 231.002
Iteration = 20   Residual = 0.0587955
Iteration = 40   Residual = 0.0251403
Iteration = 60   Residual = 0.104298
Iteration = 80   Residual = 0.0103041
Iteration = 100   Residual = 0.00738622
Iteration = 120   Residual = 0.00539686
Iteration = 140   Residual = 0.00394315
Iteration = 160   Residual = 0.00362836
Iteration = 180   Residual = 0.00204236
Iteration = 200   Residual = 0.00209959
Final Resid Norm: 0.00209959
FLUXTIME fluxsubmit wall time 0:10.04
broker.info[0]: rc2.0: /usr/bin/time -f FLUXTIME fluxsubmit wall time %E flux submit -N 4 -n32 --quiet --watch -o cpu-affinity=per-task /opt/view/bin/miniFE.x nx=230 ny=230 nz=230 use_locking=1 elem_group_size=10 use_elem_mat_fields=300 verify_solution=0 Exited (rc=0) 10.0s
broker.info[0]: rc2-success: run->cleanup 10.0467s
broker.info[0]: cleanup.0: flux jobtap remove perilog 2>/dev/null || true Exited (rc=0) 0.1s
broker.info[0]: cleanup.1: flux queue stop --quiet --all --nocheckpoint Exited (rc=0) 0.1s
broker.info[0]: cleanup.2: flux cancel --user=all --quiet --states RUN Exited (rc=0) 0.2s
broker.info[0]: cleanup.3: flux queue idle --quiet Exited (rc=0) 0.2s
broker.info[0]: cleanup-success: cleanup->shutdown 0.601764s
broker.info[0]: children-complete: shutdown->finalize 0.134446s
broker.info[0]: rc3.0: /opt/software/linux-ubuntu22.04-x86_64/gcc-11.4.0/flux-core-0.61.2-zpun7rhwtkelzplutv4nvzwj5ydo7h7p/etc/flux/rc3 Exited (rc=0) 0.2s
broker.info[0]: rc3-success: finalize->goodbye 0.205869s
broker.info[0]: goodbye: goodbye->exit 0.083115ms
FLUXTIME fluxstart wall time 0:13.38
